{
    "$schema": "../schema.json",
    "id": "create-website",
    "version": "1.0.0",
    "meta": {
        "icon": "🌐",
        "titleKey": "ai.specs.createWebsite.title",
        "descriptionKey": "ai.specs.createWebsite.description",
        "category": "creation",
        "tags": ["create", "website", "multi-page", "from-scratch"],
        "difficulty": "advanced"
    },
    "parameters": [
        {
            "id": "multilingual",
            "type": "checkbox",
            "labelKey": "ai.specs.createWebsite.params.multilingual.label",
            "helpKey": "ai.specs.createWebsite.params.multilingual.help",
            "default": true
        },
        {
            "id": "languages",
            "type": "text",
            "labelKey": "ai.specs.createWebsite.params.languages.label",
            "placeholderKey": "ai.specs.createWebsite.params.languages.placeholder",
            "helpKey": "ai.specs.createWebsite.params.languages.help",
            "default": "en",
            "condition": "multilingual === true"
        },
        {
            "id": "pages",
            "type": "text",
            "labelKey": "ai.specs.createWebsite.params.pages.label",
            "placeholderKey": "ai.specs.createWebsite.params.pages.placeholder",
            "helpKey": "ai.specs.createWebsite.params.pages.help",
            "default": "home, about, services, contact"
        }
    ],
    "dataRequirements": [
        {
            "id": "helpSetMultilingual",
            "command": "help",
            "urlParams": ["setMultilingual"],
            "extract": "data",
            "condition": "multilingual === true"
        },
        {
            "id": "helpAddLang",
            "command": "help",
            "urlParams": ["addLang"],
            "extract": "data",
            "condition": "multilingual === true"
        },
        {
            "id": "helpAddRoute",
            "command": "help",
            "urlParams": ["addRoute"],
            "extract": "data"
        },
        {
            "id": "helpEditStructure",
            "command": "help",
            "urlParams": ["editStructure"],
            "extract": "data"
        },
        {
            "id": "helpSetTranslationKeys",
            "command": "help",
            "urlParams": ["setTranslationKeys"],
            "extract": "data"
        },
        {
            "id": "helpEditStyles",
            "command": "help",
            "urlParams": ["editStyles"],
            "extract": "data"
        },
        {
            "id": "helpSetRootVariables",
            "command": "help",
            "urlParams": ["setRootVariables"],
            "extract": "data"
        }
    ],
    "relatedCommands": ["setMultilingual", "addLang", "addRoute", "editStructure", "setTranslationKeys", "editStyles", "setRootVariables"],
    "postCommands": [
        {
            "condition": "param.multilingual === true",
            "command": "editStructure",
            "params": {
                "type": "component",
                "name": "lang-switch",
                "structure": {
                    "tag": "div",
                    "params": { "class": "lang-switch" },
                    "children": {
                        "$each": "{{param.languages}}",
                        "$item": {
                            "tag": "a",
                            "params": {
                                "href": "{{__current_page;lang={{$value}}}}",
                                "class": "lang-btn",
                                "data-lang": "{{$value}}"
                            },
                            "children": [{ "textKey": "__RAW__{{$value | langname}}" }]
                        }
                    }
                }
            }
        }
    ],
    "promptTemplate": "create-website.md",
    "outputFormat": "json-commands"
}
