{
    "$schema": "../schema.json",
    "id": "global-design",
    "version": "1.0.0",
    "meta": {
        "icon": "🎨",
        "titleKey": "ai.specs.globalDesign.title",
        "descriptionKey": "ai.specs.globalDesign.description",
        "category": "style",
        "tags": ["design", "colors", "variables", "theme"],
        "difficulty": "beginner"
    },
    "parameters": [],
    "dataRequirements": [
        {
            "id": "rootVariables",
            "command": "getRootVariables",
            "extract": "data.variables"
        },
        {
            "id": "helpSetRootVariables",
            "command": "help",
            "urlParams": ["setRootVariables"],
            "extract": "data"
        }
    ],
    "relatedCommands": ["setRootVariables"],
    "promptTemplate": "global-design.md",
    "outputFormat": "json-commands"
}
